<xs:schema xmlns:xs="http://www.w3.org/2001/XMLSchema">
	<xs:element name="raiz">
		<xs:complexType>
			<xs:sequence>
				<xs:element name="a" type="xs:string" minOccurs="2" maxOccurs="3"/>
				<xs:element name="b" type="xs:string" minOccurs="2" maxOccurs="3"/>
				<xs:element name="c" type="xs:string" minOccurs="2" maxOccurs="3"/>
			</xs:sequence>
		</xs:complexType>
	</xs:element>
</xs:schema>
