<raiz xmlns:xsi="http://www.w3.org/2001/XMLSchema-instance" xsi:noNamespaceSchemaLocation="esquema20.xsd">
<a></a>
<a></a>
<b></b>
<b></b>
<b></b>
<c></c>
<c></c>
</raiz>
